,Timestamp,Description,Interst/Alarm,Confusion/Understanding,Frusteration/Relief,Sorrow/Joy,Anger/Gratitude,Fear/Hope,Boredom/Surprise,Disgust/Desire
444,1635523768.7486453,the behavior is similar to a frown face,4,2,2,2,2,2,1,2
445,1635523897.1679957,the robot stretched its hand forward and turned away,3,3,3,3,3,3,3,3
446,1635524052.5760107,the robot stretched its two hands forward and gave a surprise look,1,5,4,4,4,4,5,4
447,1635524171.80934,the robot streched its hand forward and gave both delight and surprise emotions,2,4,4,4,4,4,4,4
448,1635524297.722159,the robot gave the emotion of someone who is in love  ,1,5,5,5,5,5,5,5
449,1635524412.91147,the robot said hi but not with a delight ,2,4,4,4,4,4,4,4
450,1635531949.2411757,Looked gently to her right,1,3,3,3,3,4,2,3
451,1635532170.3546004,"She raised her right arm slightly and made a worried/surprised expression. Repeatedly bobbed her head, but not enough to be a nod. Like a cringe.",5,1,2,1,3,2,5,2
452,1635532290.7341018,"Made weird expression (eyes had hearts), gently nodded and waved with right arm.",3,4,3,4,4,3,4,4
453,1635532394.9521468,"Eyes widened, looked down/right, and lightly moved head. Like she noticed you do something mildly annoying.",4,2,2,3,2,3,2,2
454,1635532495.5759778,She looked to the left and very lightly nodded.,2,3,4,3,3,3,2,3
455,1635532581.487057,"She moved both arms forward as if offering a hug, put them down, paused, then gave me a weird sad expression with squinted eyes.",2,2,3,1,3,2,3,3
456,1635532705.448953,She very gently nodded. almost nothing.,2,4,3,3,3,3,2,3
457,1635532775.308344,"Offered both arms forward for hug, looked up, then gave star-eyes.",2,4,4,5,4,4,3,4
458,1635532876.630818,"Gave droopy-eyes and had trouble keeping head up, like she's tired. Gently moved left hand.",2,3,3,2,3,3,2,3
459,1635533002.2071605,She gently nodded her head again. Almost nothing.,2,4,3,3,3,3,3,3
460,1635533065.949463,"Once again looked down and the left and nodded her head, as if you just did something mildly annoying.",3,4,1,2,2,3,2,2
461,1635533151.2743251,"Worried eyes, gentle nod, and slight arm movement.",4,2,3,2,3,1,3,3
462,1635533151.2743251,"Worried eyes, gentle nod, and slight arm movement.",4,2,3,2,3,1,3,3
463,1635533233.0467973,"She moved her arms, then offered her left arm as if to shake hands, bowing her head.",2,4,4,3,4,3,2,4
464,1635533367.7813962,"She offered her right hand, looked right, paused, then offered her left hand with aperture-eyes. No clue what she's trying to say with this one.",2,4,4,3,3,3,3,3
465,1635786931.283174,"Said something close to a ""Hi"" but not really, Nodded their head a few times but didn't move anything else",4,3,3,3,3,3,3,3
466,1635787249.2057462,"Nodded their head a few times, said ""hey"", made a surprised face and then went back to default, slightly moved their right arm but not enough to draw attention",2,3,3,3,3,3,4,3
467,1635787461.5760276,"Said ""Hm?"" and ""Uh"", Looked over to their left, moved their right arm a few times and nodded",2,2,3,3,3,3,4,3
468,1635787606.199501,"Moved their head diagonally to the bottom right, seemed like moving their head like that was difficult, said ""Um""",4,2,3,2,3,2,3,3
469,1635787774.1071825,"Didn't move as much, didn't say anything, just nodded",3,4,3,3,3,3,3,3
470,1635787884.1979034,"Said ""Huh"", made a cheerful expression, nodded and tried to move both of their arms up",2,4,4,4,3,3,3,3
471,1635788007.7600622,"Moved their head diagonally to the top left, Said ""Um, Huh, and Hey"" kinda in that order, Made three faces; surprised, tired, and then made what seemed like camera lens for eyes",4,2,3,2,3,2,2,3
472,1635793253.7075171,Greeting ,3,3,4,2,3,2,2,3
473,1635793556.2197733,Agreeing ,3,4,3,2,4,2,3,3
474,1635793657.0961187,Welcoming ,4,4,3,3,4,4,3,4
475,1635793746.7843857,Confirming ,2,2,3,2,3,3,2,3
476,1635793853.143711,Greeting but sad ,3,3,3,2,3,3,2,3
477,1635794002.9874015,Welcoming ,2,4,3,3,4,4,3,4
478,1635794146.6971858,The robot is annoyed.,3,3,3,3,2,3,2,3
479,1635794311.916531,It is confirming ,2,4,4,3,4,4,3,4
480,1635794406.6336322,It is like pointing on something ,3,2,3,3,3,3,3,3
